{
  "as_of": "2026-10-20T12:00:00Z",
  "expected_game_ids": [
    "DEMO-1",
    "DEMO-2",
    "DEMO-3"
  ],
  "synthetic_data": true,
  "evidence": [
    {
      "id": "demo",
      "url": "https://example.org/synthetic-not-real-data",
      "checked_at": "2026-10-20T12:00:00Z"
    }
  ],
  "games": [
    {
      "game_id": "DEMO-1",
      "starts_at": "2026-10-21T01:00:00Z",
      "status": "scheduled",
      "home": {
        "name": "Demo Home 1",
        "prior": {
          "games": 82,
          "xgf_5v5_per60": 3.2,
          "xga_5v5_per60": 2.5,
          "pp_xgf_per60": 7.8,
          "pk_xga_per60": 6.2,
          "pp_drawn_per_game": 3.1,
          "penalties_taken_per_game": 3.2,
          "shots_for_per_game": 31.0,
          "shots_against_per_game": 29.0,
          "high_danger_for_per60": 11.0,
          "high_danger_against_per60": 9.0,
          "points_pct": 0.59,
          "source": {
            "url": "https://example.org/synthetic-not-real-data",
            "checked_at": "2026-10-20T12:00:00Z",
            "status": "synthetic"
          }
        },
        "current": {
          "games": 5,
          "xgf_5v5_per60": 3.4000000000000004,
          "xga_5v5_per60": 2.65,
          "pp_xgf_per60": 9.3,
          "pk_xga_per60": 6.2,
          "pp_drawn_per_game": 3.1,
          "penalties_taken_per_game": 3.2,
          "shots_for_per_game": 31.0,
          "shots_against_per_game": 29.0,
          "high_danger_for_per60": 11.0,
          "high_danger_against_per60": 9.0,
          "points_pct": 0.59,
          "source": {
            "url": "https://example.org/synthetic-not-real-data",
            "checked_at": "2026-10-20T12:00:00Z",
            "status": "synthetic"
          }
        },
        "goalie": {
          "name": "Demo Home 1 DEMO GOALIE",
          "status": "confirmed",
          "starts_current": 3,
          "starts_prior": 30,
          "gsax_per60_current": 0.4,
          "gsax_per60_prior": 0.05,
          "source": {
            "url": "https://example.org/synthetic-not-real-data",
            "checked_at": "2026-10-20T12:00:00Z",
            "status": "synthetic"
          }
        },
        "roster": {
          "quantified": true,
          "attack_delta_goals": 0.0,
          "defense_delta_goals_allowed": 0.0,
          "absences": [],
          "returns": [],
          "scratches": [],
          "forward_lines": [
            "DEMO ONLY"
          ],
          "defense_pairs": [
            "DEMO ONLY"
          ],
          "power_play_units": [
            "DEMO ONLY"
          ],
          "source": {
            "url": "https://example.org/synthetic-not-real-data",
            "checked_at": "2026-10-20T12:00:00Z",
            "status": "synthetic"
          }
        },
        "context": {
          "rest_days": 2,
          "travel_timezones": 0
        }
      },
      "away": {
        "name": "Demo Away 1",
        "prior": {
          "games": 82,
          "xgf_5v5_per60": 2.6,
          "xga_5v5_per60": 3.1,
          "pp_xgf_per60": 6.9,
          "pk_xga_per60": 7.7,
          "pp_drawn_per_game": 3.1,
          "penalties_taken_per_game": 3.2,
          "shots_for_per_game": 31.0,
          "shots_against_per_game": 29.0,
          "high_danger_for_per60": 11.0,
          "high_danger_against_per60": 9.0,
          "points_pct": 0.59,
          "source": {
            "url": "https://example.org/synthetic-not-real-data",
            "checked_at": "2026-10-20T12:00:00Z",
            "status": "synthetic"
          }
        },
        "current": {
          "games": 5,
          "xgf_5v5_per60": 2.8000000000000003,
          "xga_5v5_per60": 3.25,
          "pp_xgf_per60": 8.4,
          "pk_xga_per60": 7.7,
          "pp_drawn_per_game": 3.1,
          "penalties_taken_per_game": 3.2,
          "shots_for_per_game": 31.0,
          "shots_against_per_game": 29.0,
          "high_danger_for_per60": 11.0,
          "high_danger_against_per60": 9.0,
          "points_pct": 0.59,
          "source": {
            "url": "https://example.org/synthetic-not-real-data",
            "checked_at": "2026-10-20T12:00:00Z",
            "status": "synthetic"
          }
        },
        "goalie": {
          "name": "Demo Away 1 DEMO GOALIE",
          "status": "confirmed",
          "starts_current": 3,
          "starts_prior": 30,
          "gsax_per60_current": 0.4,
          "gsax_per60_prior": 0.05,
          "source": {
            "url": "https://example.org/synthetic-not-real-data",
            "checked_at": "2026-10-20T12:00:00Z",
            "status": "synthetic"
          }
        },
        "roster": {
          "quantified": true,
          "attack_delta_goals": 0.0,
          "defense_delta_goals_allowed": 0.0,
          "absences": [],
          "returns": [],
          "scratches": [],
          "forward_lines": [
            "DEMO ONLY"
          ],
          "defense_pairs": [
            "DEMO ONLY"
          ],
          "power_play_units": [
            "DEMO ONLY"
          ],
          "source": {
            "url": "https://example.org/synthetic-not-real-data",
            "checked_at": "2026-10-20T12:00:00Z",
            "status": "synthetic"
          }
        },
        "context": {
          "rest_days": 2,
          "travel_timezones": 0
        }
      },
      "markets": [
        {
          "id": "total-over45-0",
          "kind": "total",
          "selection": "over",
          "odds": 1.25,
          "line": 4.5,
          "score_basis": "official_final",
          "settlement_verified": true,
          "rules_url": "https://example.org/synthetic-not-real-data",
          "source": {
            "url": "https://example.org/synthetic-not-real-data",
            "checked_at": "2026-10-20T12:00:00Z",
            "status": "synthetic"
          }
        },
        {
          "id": "total-under75-0",
          "kind": "total",
          "selection": "under",
          "odds": 1.28,
          "line": 7.5,
          "score_basis": "official_final",
          "settlement_verified": true,
          "rules_url": "https://example.org/synthetic-not-real-data",
          "source": {
            "url": "https://example.org/synthetic-not-real-data",
            "checked_at": "2026-10-20T12:00:00Z",
            "status": "synthetic"
          }
        },
        {
          "id": "home-hcp-0",
          "kind": "handicap",
          "selection": "home",
          "odds": 1.27,
          "line": -0.5,
          "score_basis": "official_final",
          "settlement_verified": true,
          "rules_url": "https://example.org/synthetic-not-real-data",
          "source": {
            "url": "https://example.org/synthetic-not-real-data",
            "checked_at": "2026-10-20T12:00:00Z",
            "status": "synthetic"
          },
          "team": "home"
        },
        {
          "id": "home-moneyline-0",
          "kind": "moneyline",
          "selection": "home",
          "odds": 1.25,
          "line": null,
          "score_basis": "official_final",
          "settlement_verified": true,
          "rules_url": "https://example.org/synthetic-not-real-data",
          "source": {
            "url": "https://example.org/synthetic-not-real-data",
            "checked_at": "2026-10-20T12:00:00Z",
            "status": "synthetic"
          }
        },
        {
          "id": "home-team-over25-0",
          "kind": "team_total",
          "selection": "over",
          "odds": 1.28,
          "line": 2.5,
          "score_basis": "official_final",
          "settlement_verified": true,
          "rules_url": "https://example.org/synthetic-not-real-data",
          "source": {
            "url": "https://example.org/synthetic-not-real-data",
            "checked_at": "2026-10-20T12:00:00Z",
            "status": "synthetic"
          },
          "team": "home"
        },
        {
          "id": "home-60min-0",
          "kind": "regulation_1x2",
          "selection": "home",
          "odds": 1.26,
          "line": null,
          "score_basis": "regulation",
          "settlement_verified": true,
          "rules_url": "https://example.org/synthetic-not-real-data",
          "source": {
            "url": "https://example.org/synthetic-not-real-data",
            "checked_at": "2026-10-20T12:00:00Z",
            "status": "synthetic"
          }
        }
      ],
      "checks": {
        "fields": {
          "home.prior.games": {
            "status": "found",
            "evidence_ids": [
              "demo"
            ],
            "note": ""
          },
          "home.prior.points_pct": {
            "status": "found",
            "evidence_ids": [
              "demo"
            ],
            "note": ""
          },
          "home.prior.xgf_5v5_per60": {
            "status": "found",
            "evidence_ids": [
              "demo"
            ],
            "note": ""
          },
          "home.prior.xga_5v5_per60": {
            "status": "found",
            "evidence_ids": [
              "demo"
            ],
            "note": ""
          },
          "home.prior.pp_xgf_per60": {
            "status": "found",
            "evidence_ids": [
              "demo"
            ],
            "note": ""
          },
          "home.prior.pk_xga_per60": {
            "status": "found",
            "evidence_ids": [
              "demo"
            ],
            "note": ""
          },
          "home.prior.pp_drawn_per_game": {
            "status": "found",
            "evidence_ids": [
              "demo"
            ],
            "note": ""
          },
          "home.prior.penalties_taken_per_game": {
            "status": "found",
            "evidence_ids": [
              "demo"
            ],
            "note": ""
          },
          "home.prior.shots_for_per_game": {
            "status": "found",
            "evidence_ids": [
              "demo"
            ],